{
  "task_schema_version": "1.0",
  "task_type": "source_revision.process",
  "task_id": "task-source-revision-1",
  "event_id": "evt-source-revision-1",
  "trace_id": "trace-source-revision-1",
  "idempotency_key": "idem-source-revision-0001",
  "project_id": "project-1",
  "source_object_id": "source-object-1",
  "source_revision_id": "source-revision-1",
  "source_zone_key": "source-zone/project-1/source-revision-1/document.pdf",
  "content_sha256": "aaaaaaaaaaaaaaaaaaaaaaaaaaaaaaaaaaaaaaaaaaaaaaaaaaaaaaaaaaaaaaaa",
  "content_type": "application/pdf",
  "content_length": 1024,
  "deadline_at": "2026-08-13T08:05:00Z",
  "attempt": 1,
  "max_attempts": 3,
  "resource_class": "cpu"
}
